[
  {
    "confidence": "high",
    "forecast_value": 6.6,
    "forecaster": "MOCK_IMF",
    "horizon_years": 1,
    "id": "fv1",
    "indicator": "gdp_growth_real_pct",
    "locator": null,
    "retrieved_at": "2026-10-02",
    "snippet": null,
    "source": "MOCK",
    "source_id": "mock:M001",
    "source_url": null,
    "target_year": 2008,
    "unit": "pct",
    "vintage_date": "2007-04-01"
  },
  {
    "confidence": "high",
    "forecast_value": 2.7,
    "forecaster": "MOCK_IMF",
    "horizon_years": 2,
    "id": "fv2",
    "indicator": "gdp_growth_real_pct",
    "locator": null,
    "retrieved_at": "2026-10-02",
    "snippet": null,
    "source": "MOCK",
    "source_id": "mock:M002",
    "source_url": null,
    "target_year": 2008,
    "unit": "pct",
    "vintage_date": "2006-04-01"
  },
  {
    "confidence": "high",
    "forecast_value": 0.1,
    "forecaster": "MOCK_IMF",
    "horizon_years": 3,
    "id": "fv3",
    "indicator": "gdp_growth_real_pct",
    "locator": null,
    "retrieved_at": "2026-10-02",
    "snippet": null,
    "source": "MOCK",
    "source_id": "mock:M003",
    "source_url": null,
    "target_year": 2008,
    "unit": "pct",
    "vintage_date": "2005-04-01"
  },
  {
    "confidence": "high",
    "forecast_value": -2.2,
    "forecaster": "MOCK_IMF",
    "horizon_years": 4,
    "id": "fv4",
    "indicator": "gdp_growth_real_pct",
    "locator": null,
    "retrieved_at": "2026-10-02",
    "snippet": null,
    "source": "MOCK",
    "source_id": "mock:M004",
    "source_url": null,
    "target_year": 2008,
    "unit": "pct",
    "vintage_date": "2004-04-01"
  },
  {
    "confidence": "high",
    "forecast_value": 1.0,
    "forecaster": "MOCK_IMF",
    "horizon_years": 5,
    "id": "fv5",
    "indicator": "gdp_growth_real_pct",
    "locator": null,
    "retrieved_at": "2026-10-02",
    "snippet": null,
    "source": "MOCK",
    "source_id": "mock:M005",
    "source_url": null,
    "target_year": 2008,
    "unit": "pct",
    "vintage_date": "2003-04-01"
  },
  {
    "confidence": "high",
    "forecast_value": 6.1,
    "forecaster": "MOCK_IMF",
    "horizon_years": 1,
    "id": "fv6",
    "indicator": "gdp_growth_real_pct",
    "locator": null,
    "retrieved_at": "2026-10-02",
    "snippet": null,
    "source": "MOCK",
    "source_id": "mock:M006",
    "source_url": null,
    "target_year": 2009,
    "unit": "pct",
    "vintage_date": "2008-04-01"
  },
  {
    "confidence": "high",
    "forecast_value": -0.8,
    "forecaster": "MOCK_IMF",
    "horizon_years": 2,
    "id": "fv7",
    "indicator": "gdp_growth_real_pct",
    "locator": null,
    "retrieved_at": "2026-10-02",
    "snippet": null,
    "source": "MOCK",
    "source_id": "mock:M007",
    "source_url": null,
    "target_year": 2009,
    "unit": "pct",
    "vintage_date": "2007-04-01"
  },
  {
    "confidence": "high",
    "forecast_value": 2.2,
    "forecaster": "MOCK_IMF",
    "horizon_years": 3,
    "id": "fv8",
    "indicator": "gdp_growth_real_pct",
    "locator": null,
    "retrieved_at": "2026-10-02",
    "snippet": null,
    "source": "MOCK",
    "source_id": "mock:M008",
    "source_url": null,
    "target_year": 2009,
    "unit": "pct",
    "vintage_date": "2006-04-01"
  },
  {
    "confidence": "high",
    "forecast_value": -1.8,
    "forecaster": "MOCK_IMF",
    "horizon_years": 4,
    "id": "fv9",
    "indicator": "gdp_growth_real_pct",
    "locator": null,
    "retrieved_at": "2026-10-02",
    "snippet": null,
    "source": "MOCK",
    "source_id": "mock:M009",
    "source_url": null,
    "target_year": 2009,
    "unit": "pct",
    "vintage_date": "2005-04-01"
  },
  {
    "confidence": "high",
    "forecast_value": 0.5,
    "forecaster": "MOCK_IMF",
    "horizon_years": 5,
    "id": "fv10",
    "indicator": "gdp_growth_real_pct",
    "locator": null,
    "retrieved_at": "2026-10-02",
    "snippet": null,
    "source": "MOCK",
    "source_id": "mock:M010",
    "source_url": null,
    "target_year": 2009,
    "unit": "pct",
    "vintage_date": "2004-04-01"
  },
  {
    "confidence": "high",
    "forecast_value": -3.1,
    "forecaster": "MOCK_IMF",
    "horizon_years": 1,
    "id": "fv11",
    "indicator": "gdp_growth_real_pct",
    "locator": null,
    "retrieved_at": "2026-10-02",
    "snippet": null,
    "source": "MOCK",
    "source_id": "mock:M011",
    "source_url": null,
    "target_year": 2010,
    "unit": "pct",
    "vintage_date": "2009-04-01"
  },
  {
    "confidence": "high",
    "forecast_value": -1.9,
    "forecaster": "MOCK_IMF",
    "horizon_years": 2,
    "id": "fv12",
    "indicator": "gdp_growth_real_pct",
    "locator": null,
    "retrieved_at": "2026-10-02",
    "snippet": null,
    "source": "MOCK",
    "source_id": "mock:M012",
    "source_url": null,
    "target_year": 2010,
    "unit": "pct",
    "vintage_date": "2008-04-01"
  },
  {
    "confidence": "high",
    "forecast_value": 5.7,
    "forecaster": "MOCK_IMF",
    "horizon_years": 3,
    "id": "fv13",
    "indicator": "gdp_growth_real_pct",
    "locator": null,
    "retrieved_at": "2026-10-02",
    "snippet": null,
    "source": "MOCK",
    "source_id": "mock:M013",
    "source_url": null,
    "target_year": 2010,
    "unit": "pct",
    "vintage_date": "2007-04-01"
  },
  {
    "confidence": "high",
    "forecast_value": -2.2,
    "forecaster": "MOCK_IMF",
    "horizon_years": 4,
    "id": "fv14",
    "indicator": "gdp_growth_real_pct",
    "locator": null,
    "retrieved_at": "2026-10-02",
    "snippet": null,
    "source": "MOCK",
    "source_id": "mock:M014",
    "source_url": null,
    "target_year": 2010,
    "unit": "pct",
    "vintage_date": "2006-04-01"
  },
  {
    "confidence": "high",
    "forecast_value": 4.4,
    "forecaster": "MOCK_IMF",
    "horizon_years": 5,
    "id": "fv15",
    "indicator": "gdp_growth_real_pct",
    "locator": null,
    "retrieved_at": "2026-10-02",
    "snippet": null,
    "source": "MOCK",
    "source_id": "mock:M015",
    "source_url": null,
    "target_year": 2010,
    "unit": "pct",
    "vintage_date": "2005-04-01"
  },
  {
    "confidence": "high",
    "forecast_value": -2.0,
    "forecaster": "MOCK_IMF",
    "horizon_years": 1,
    "id": "fv16",
    "indicator": "gdp_growth_real_pct",
    "locator": null,
    "retrieved_at": "2026-10-02",
    "snippet": null,
    "source": "MOCK",
    "source_id": "mock:M016",
    "source_url": null,
    "target_year": 2011,
    "unit": "pct",
    "vintage_date": "2010-04-01"
  },
  {
    "confidence": "high",
    "forecast_value": 3.6,
    "forecaster": "MOCK_IMF",
    "horizon_years": 2,
    "id": "fv17",
    "indicator": "gdp_growth_real_pct",
    "locator": null,
    "retrieved_at": "2026-10-02",
    "snippet": null,
    "source": "MOCK",
    "source_id": "mock:M017",
    "source_url": null,
    "target_year": 2011,
    "unit": "pct",
    "vintage_date": "2009-04-01"
  },
  {
    "confidence": "high",
    "forecast_value": -2.0,
    "forecaster": "MOCK_IMF",
    "horizon_years": 3,
    "id": "fv18",
    "indicator": "gdp_growth_real_pct",
    "locator": null,
    "retrieved_at": "2026-10-02",
    "snippet": null,
    "source": "MOCK",
    "source_id": "mock:M018",
    "source_url": null,
    "target_year": 2011,
    "unit": "pct",
    "vintage_date": "2008-04-01"
  },
  {
    "confidence": "high",
    "forecast_value": -2.0,
    "forecaster": "MOCK_IMF",
    "horizon_years": 4,
    "id": "fv19",
    "indicator": "gdp_growth_real_pct",
    "locator": null,
    "retrieved_at": "2026-10-02",
    "snippet": null,
    "source": "MOCK",
    "source_id": "mock:M019",
    "source_url": null,
    "target_year": 2011,
    "unit": "pct",
    "vintage_date": "2007-04-01"
  },
  {
    "confidence": "high",
    "forecast_value": -1.5,
    "forecaster": "MOCK_IMF",
    "horizon_years": 5,
    "id": "fv20",
    "indicator": "gdp_growth_real_pct",
    "locator": null,
    "retrieved_at": "2026-10-02",
    "snippet": null,
    "source": "MOCK",
    "source_id": "mock:M020",
    "source_url": null,
    "target_year": 2011,
    "unit": "pct",
    "vintage_date": "2006-04-01"
  },
  {
    "confidence": "high",
    "forecast_value": -4.8,
    "forecaster": "MOCK_IMF",
    "horizon_years": 1,
    "id": "fv21",
    "indicator": "gdp_growth_real_pct",
    "locator": null,
    "retrieved_at": "2026-10-02",
    "snippet": null,
    "source": "MOCK",
    "source_id": "mock:M021",
    "source_url": null,
    "target_year": 2012,
    "unit": "pct",
    "vintage_date": "2011-04-01"
  },
  {
    "confidence": "high",
    "forecast_value": 5.8,
    "forecaster": "MOCK_IMF",
    "horizon_years": 2,
    "id": "fv22",
    "indicator": "gdp_growth_real_pct",
    "locator": null,
    "retrieved_at": "2026-10-02",
    "snippet": null,
    "source": "MOCK",
    "source_id": "mock:M022",
    "source_url": null,
    "target_year": 2012,
    "unit": "pct",
    "vintage_date": "2010-04-01"
  },
  {
    "confidence": "high",
    "forecast_value": 5.4,
    "forecaster": "MOCK_IMF",
    "horizon_years": 3,
    "id": "fv23",
    "indicator": "gdp_growth_real_pct",
    "locator": null,
    "retrieved_at": "2026-10-02",
    "snippet": null,
    "source": "MOCK",
    "source_id": "mock:M023",
    "source_url": null,
    "target_year": 2012,
    "unit": "pct",
    "vintage_date": "2009-04-01"
  },
  {
    "confidence": "high",
    "forecast_value": -3.4,
    "forecaster": "MOCK_IMF",
    "horizon_years": 4,
    "id": "fv24",
    "indicator": "gdp_growth_real_pct",
    "locator": null,
    "retrieved_at": "2026-10-02",
    "snippet": null,
    "source": "MOCK",
    "source_id": "mock:M024",
    "source_url": null,
    "target_year": 2012,
    "unit": "pct",
    "vintage_date": "2008-04-01"
  },
  {
    "confidence": "high",
    "forecast_value": -1.3,
    "forecaster": "MOCK_IMF",
    "horizon_years": 5,
    "id": "fv25",
    "indicator": "gdp_growth_real_pct",
    "locator": null,
    "retrieved_at": "2026-10-02",
    "snippet": null,
    "source": "MOCK",
    "source_id": "mock:M025",
    "source_url": null,